subreddit,processed_text
0,hotel use pen recommendation work hotel pen use abit odd try find good brand pen use cardstock key sleeve semi laminate avoid gel pen inexpensive pentel ballpoint pen look nice brand abit partner use style work mysteriously vanish look fond zebra pen especially steel bodied one comfortable use long main feature need clip breast pocket usually use clip pen shirt button work polo wear retractable pen sturdy clip great feature have trouble find find brand amazon imnxidk sturdy clip design use feedback sturdy actually feedback pen regard kindof specific use case love recommendation
0,try find favorite join community want find favorite edc pen pick zebra parker jotter available local store zebra like bit probably big mm ink concern textured grip uncomfortable extended period time parker jotter want like tapered end severe finger slide tip write go thick narrow pretty quickly feel weird grip similar thought recommendation similar styling parker jotter
0,sort numbering zebra series gel pen question zebra series gel pen large number equal well theory see clearance price local walgreens yesterday consider well good work numbering speak distinctive warrant recommendation thank
0,taroko pen experience taroko pen universal cartridge holder
0,pen recommendation sideways write hello new community stop ask pen recommendation write sideways hold pen high tip hit page low angle straight pen handle well usually find scratch page ball point pen hold ball make sense completely unaware issue run go fountain pen rabbit hole cheap ball point pen recommendation welcome note sure issue fountain pen feel like hear drag pen push look calligraphy math major write fast like versatile thank
0,hi techpoint inconsistent ink flow got blue hi techpoint pen write time ink flow scratchy faint second time dark smooth new pretty ink go
0,look gel refill pentel superb hey guy enjoy writing wonder gel refill try idea
0,smooth pen possible note school work hello want smooth pen possible regular paper fond fountain pen try open
0,pilot limited metallic body gel pen pilot pen barrel color black look red blue body reasonable price black body pen amazon reference pilot website show black body black ink body color discontinue covid supply chain issue tia sid
0,enjoy new jetstream parker refill enjoy jetstream parker refill sure ebay seller know buy refill combine slot parker im think refill decision decision
0,help find pen boyfriend buy pen holder antique shop come mechanical pencil see image pen look identical pen month go miss week ago time look search bleak want buy new darn good pen branding inside pencil outside identify incredibly grateful cheer
0,know sakura craft lab pen good normally japan buy high pilot frixion zebra pen expensive tend lose home expensive careless think buy careless notice sakura craft labs pen like look version
0,manage edc fountain pen worry ink leak novice level fountain pen enthusiast decide buy pilot kakuno edc doctor prefer worry ruin shirt trouser pocket ink couple embarrassing event chinese rip pen past think pilot kakuno sturdy edc tip well handle pen
0,difference cap pentel energel pen wonder difference look new everyday fast dry gel pen look
0,cross silver ball rollerball point century ii pen find ground job look interesting online know
0,pen refill suggestion lefty hey folk great group look rollerball gel pen good overall everyday writing dot grid journaling etc major consideration leave handed bad luck smearing write suggestion alternative refill suggestion greatly appreciate thank
0,pen compatible refill refill compatible pen
0,know reassemble pen artline clix
0,rare rotring prototype inoxcrom rotring image plumahispana
0,look base random accident stumble pen little ago long time write instrument owner gift mont blanc sit desk rotring parker jotter xls schmidt easyflow refill unhappy course feeling obsession stop guess thank thank
0,rotring pen absolute favorite pick rotre rollerball fountain pen original gold retractable pencil load pen fisher space cartridge fan feel write particularly heavily utility etc look identical original design little short stamp logo clip define complaint button feel cheap picture monami preciously hold space cartridge button way nicer rotring button lot play scrap side loudly press add drop oil press couple time fidget lot pen feel little well let spring jam love pen recommendation super smooth heavy duty refill
0,pen look like write nicely
0,lazy saturday poll store house pen brand like feel like house pen brand retail store overlook ask pen like think underrated sad discontinue particular favorite model etc etc view
0,okay pen smudge judge kinda like look page hand like century writer lol edit store buy brand prefer
0,help request look reliable non disposable daily driver forever pen budget flexible want disposable pen invest little nice reliability heavy bulky main criterion tend favour long skinny pen vs short round record disposable uniball onyx mm help totally novice great
0,uni kuru toga vs rotring see rotring super interested use uni kuru toga wonderful kuru toga rotring share insight pro con pen prefer
0,look source pen come pen drawer house excellent love order find brand name look mercedes emblem lid able help great
0,worth find well recommend tia
0,tul rollerball mm update picture pens guess way load last year color take grant pack certain office depot max house brand manufacture sell long green purple amazing unfortunate life go think tul gallery
0,pen shop narita japan find uni jetstream edge hi look uni jetstream edge mm narita japan significant lay find pen thank
0,micron not glide fact pen like pen feel sticky glide smoothly page muji ballpoint uni ball gel pen feel like move smooth piece wood page design faulty pen sorry describe
0,switch tip decide switch standard tip fountain pen tip prometheus alpha pen forget bright shinny new copper body year half natural patina
0,pen order recently director office say max office supply order need come talk pen right solo retractable stylus promotional pen pen hangry environment bind walk away pocket go style brand write utensil short span life loyal come thing good life temporary realm earth come court reddit openion use fsi office vendor like style option signature meeting mins notes everyday use open idea pen pack want oooo ahhh factor person feeling man pen dare let use thx advance
0,extra fine suggestion extra fine suggestion pen ball point rollerball gel fountain fine line well write tiny usually line college rule line currently uni signo mm study color pack like super concerned price run buy platinum ultra extra fine nib like preferably pack color study moment
0,ohto question confirm pen work precise refill
0,technical pens everyday writing seek advice worth maintain technical pen daily writing use happy advice read folk need clean technical pen use week regularly coordinate fountain pen decade primarily use lamy kwaeco fine nib draw line thick taste ef nibs offer fine prefer refillable pen cartridge refill small cramped handwriting style prefer mm nib handwriting rollerball interested disposable wonder technical pen like rotring isograph work thank help
0,need fine mm gel refill lamy safari rollerball not think lamy make refill fine point hear refill little modification good option preferably gel fine point ink know question answer probably refill felt tip like stabilo uni pin thank
0,glittery gel pen straight glitt fill weak shimmer use kryolan glitt blast glitter stick hopefully fall issue pentel duo chrome pen fit criterion buy glitt marker
0,look large sized pen write hello run issue cramping note take overall review think large pen body work write high make handwriting illegible recommendation appreciate context primarily use sarasa dry pen pilot pen
0,cross refill carry pen pencil set bag year good pen cartridge recommend refill prefer
0,pen recommendation hi look get nice pen like suggestion base give criterion metal easy find refill will smudge leave handed preferably quick dry ink ballpoint fan usd currently standard parker jotter xl feel bit small click feel bit loud meeting pretty happy think maybe get parker jotter xl caran rollerball ohto flash dry refill pen refill recommendation greatly appreciate thank
0,current collection get nice organizer thing get little hand organizer pilot hi tec maica schneider basic pilot mm mean girls edition zebra mildliner uni propus assorted sakura gelly roll pilot mm uniball jetstream pilot juice mm zebra sarasa clip vintage pack mm rack zebra sarasa clip mm marble color micron limited edition black barrel pen cup pilot mm pilot mm uniball signo mm zebra sarasa dry mm pentel energel mm sharpie gel mm ordered tombow pressurized oil based ballpoint mm uniball inch peach
0,primary edc rest list able recognize
0,zebra sarasa grand time new refill nice write sure long
0,light crazy
0,fountain pen vs pilot dry time pilot year want fountain pen wonder rollerball gel pen long fountain pen typically dry context primarily concerned writing flashcard write lot currently use pilot think get lamy safari similar starter level fountain pen
0,pen ridged section definite affection sheaffer triumph nib fountain pen discover ballpoint equivalent stratowriter find comfortable write modern pen ridged section pen see gravitas pens
0,expect manifesto soon away pilot plague worldly evil weasele way hand home wife child hold dearly highly praised sub par writing experience stand sit spotty write job bic write way ink need stop halfway need pen leave family commit armed robbery burn orphanage praise pen let continue smudgery pen propaganda kill innovation hope want decent writing experience opinion test pen
0,use faber castell hexo ballpoint look faber castell hexo faber castell hexo ballpoint pen black dp ref find review find fountain pen counter like good look metal pen twist mechanism amazon claim fragile use pen like know experience grip ink parker refill fisher space pen refill fit thank
0,parker fountain pen
0,pen use realistic ish treasure map believe quill authentic want use quill reason knowledgeable pen come ask fountain pen metal dip pen glass dip pen good kind entirely parchment paper like use black red ink suggestion help suggestion different paper appreciate help limited experience fountain pen experience dip pen
0,montblanc carbon fiber ballpoint identification hi receive pen patient gift wonder help identify authenticate montblanc pen ballpoint image search think montblanc starwalker carbon fiber ultimate carbon anthracite texturing grip right serial number clip way go want sure thank appear genuine ebay photo grip texturing appear
0,uni ball vision rollerball hey uni ball mm tip rollerball compare cheap option uni ball onyx rollerball pen consider look
0,interesting npd
0,canadian fairmont pen idea make absolutely love pen favourite pen write super smooth right friction handwriting love know make buy instead have go fairmont
0,pen id watch caleb hammer financial audit wonder pen
0,pen pick
0,need good pen stat take manager high school baseball program stat note game think invest good pen preferably
0,blue black favourite recently try blue black ink truth like recommend good edc blue black pen thank image jet pen
0,damn find special petrol edition lamy safari notify lamy bring new special edition get million notification time stuff care pen
0,rotre type pen uni signo gel refill hello post group cheap ballpoint stumble uniball air world change try uniball pilot fan uniball pen especially hook life vision elite later move fountain pen want comfortable gel pen everyday use find sub fall love pen like rotring zebra etc heavy come good grip keep get signo refill like jetstream refill like ballpoint ink look page sort uniball pen similar uniball jetstream edge jetstream alpha gel kindly help query uni signo refill alternative well similar rotre signo refill job require use permanent ink use refill like pentel energel
0,replace plastic bit thread plastic start snap try superglue simply work option find replacement know start look option maybe print thread small print accurately
0,need oil base ballpoint reccomendation exam come tell use ballpoint pen gel pen reason oilbase ballpoint safe paper scan industrial scanner supposedly gel pen ink run usually use uniball signo uniball clickgel gel pen rubber grip comfortable overall thickness pen ergonomic large hand right friction handwriting retractable ink hand suggest similar ballpoint pen go local stationery shop give uniball jetsteam toooo smooth tell rollerball pen liquid ink cause problem
0,size ink refill comparable zebra gel pen refill need refill small zebra pen get zebra gel pen refill love size refill similar fit regular sized pen love mini zebra pen great write sentence time
0,want pen idea
0,current work rotation parker jotter engrave parker jotter xl zebra rotring smootherpro zebra uni power tank pen schmidt easy flow ask tip month ago durable pen mechanic far zero complaint parker feel fancy use work
0,zebra brand pen sale lol
0,look stumble box sharpie extra fine point marker literally save ebay search sunday monday morning get see click buy fast score know know week
0,look id left pen image find
0,ink stick pen tip write ink stick nib pen pelikan way fix try rub paper prevent ugly stain write happen pelikan cartridge happen parker get tip
0,authentic hi guy get pen altho feel heavy component clip strong sure real able tell look authenticate mont blanc look forward hear feedback cheers
0,go pen review website factor use intend post finding pen website course buy new copy intend review curious factor like consider like sort thing possibly miss thank will dramatic feeling
0,current rotation complaint
0,staedtler pigment liner break buy set pigment liners month ago break particularly heavy hand sakura pigma micron bend bend tip like weak plastic give moment steadtler fantastic particularly like super tiny one writte similar happen buy amazon amazon seler suspect foul play update fill form steadtler site inside like reply quality control team ask detail chase batch number big problem ask address send replacement customer service
0,imdb internet movie database pen internet movie database internet movie firearm database internet movie pen database
0,pilot know pen
0,cross id id cross use refill thank
0,pen order bunch uni ball pen online come free gift possibly good pen luck clue brand clue
0,need advice easy use formal pen go perform wedding friend ceremony like classy official look pen hard use struggle messy handwriting want glide easily clot smear budget prefer recommendation
0,extreme fine tip recommendation look extremely fine tip pen mm small write extremely small big letter blob try different pen mainly one show feel smooth slightly big recently try hi tec line okay word ink start fade away sheet paper nearby draw circle ink tip think get bad batch pen hate suggestion pen size appreciate
0,high quality look quality stylish pen read article today see pen nice pen get
0,parker mm blue gel refill exist find
0,need write school hey like help write school stock properly use cheap thin ballpoint pen stop write week surprised refill cost cent apiece try gel pen thick liking highlighter smear choose cheap thin pen thin reasonably price resistant smear highlighter plus point last week ship europe help greatly appreciate
0,best pens vacutainer label hi get question ask especially fellow mls pen label px demographic age sex bday date today bd vacutainer vacuette greiner tube currently acroball ef works best non pen pilot twin marker perform outstandingly amazing stingey pen change pen depend pen use guy try uni pen pen work remarkably reco guy thank title error vacutainer labelling sorry study
0,pen plz help uk fave pen marking rub know brand help appreciate
0,year pen fountainpens subreddit order favorite favorite come writing experience expensive paperweight year glad lot people pen like sell lose nice one one like
0,help identify favorite pen hello penthusiast hope help identify favorite pen clearly sort possibly original xbox promotional aside xbox marking find info say taiwan thing smooth get to close year old love fear day thing run get real smooth twist tip action open force make fear break metal close heft overall pretty light help appreciate thank
0,pen see tim burton draw tattoo marker pen
0,good ballpoint pen draw black paper try draw black paper ballpoint pen ink barely visible good ballpoint pen draw black paper ink actually visible try search google ballpoint pen work black paper recommend gel pen marker pen
0,pen similar accordion knock button action lamy safari search high low time find similar pen squishy accordion click discontinue pentel smash tombow protect mechanical pencil version
0,try pen kick buy ton recently look try look interesting see perform open recs especially like interesting color import pilot black blue mean girl collection pink pilot pilot acroball pilot hi tec maica pilot juice zebra sarasa dry zebra sarasa clip vintage color pentel energel uniball signo uniball jetstream
0,kind soul tell uniball fit umr refill possible test
0,difference refill hi fairly recently get parker jotter like get couple different refill try like parker ball refill medium black dp gel refill get today parker jotter originals refill smooth dp refill confused parker gel refill standard size size etc reason second close half price assume miss difference cheap thank
0,schmidt megaline alternative recently buy pen enjoy stock refill hot garbage try bunch search find substantial refill cross compatible know work easily modify work bunch writing small quick note need great writing implement write upside leave right fire mordor write clearly blob thank
0,acme write tool hello father pass landscape architect carry nice pen pocket sketch design small piece paper napkin friend family discover pen curious special valuable way guidance advice greatly appreciate
0,npd nba psg pens hell yeah
0,parker pen help find clean parent basement wonder model gel refill refill recommendation thank
0,know pen brand
0,know discontinue gel version good substitute favorite year know love sure consider trash handwriting look nice caligraphy like pen
0,couleur pilot good pen help locate
0,de cartier pick year ago forget see group thank remind lol
0,id thriftstore find helpfull edc people send
0,good experience parker fountain pen review ink faint dry camlin ink present india dark ink nib kind problem smooth near tear paper altogether able use pen reason indian standard expensive pen come parker proper quality check
0,plastic parker gel refill get parker gel refill amazon advertise look like metal arrive turn plastic labeling packaging slightly different care realize work refyne problem parker gel refill come gray packaging actually metal gray package say france rainbow package say china go jetpens order uni jetstream kaweco sport gel try hope turn well schmidt easyflow come pen work fine want find favorite
0,upgrade version pilot penmanship love write pilot penmanship extra fine nib like upgrade well look body use edc pilot stripe custom ef nib compliment custom nib little soft write grip section keep unscrew barrel staple penmanship annoyed custom pleasure use nib anyways feeling penmanship upgrade thank edit ps think get elite extra fine try penshow feeling penmanship course
0,search good affordable pen get bit pen lately search good cheap pen buy try choose miss picture sarasa mark buy try dupont olympio like
0,good pencil pen case reasonable cost leather pen pouch come etsy right recently get lihit lab pen pencil pouch amazon start lihit version fine cheap pen want track backpack good nice pen good range little care well pen travel desk drawer tia sid
0,build luxury pen collection little little body pen suggestion let know
0,pen favorite pen
0,pen search hour pen idea pen sad obsession need pen lol
0,possible refill try identify kind refill pen use job give appreciation gift like metal body good weight love knurle metal grip look bettoni fan write think try well refill sure kind refill mm long mm wide
0,try find juicy pen bic gelocity work pen tend vary time purchase hate grip dig hand hold pen close tip muji strongly recommend buy version muji pen dull smooth railroad pen see life well pen pentel energel conical tip good pen smudge tend use lot pen time dry fairly quickly smooth reliable zebra sarasa darkest smooth pen long care smudge need pen sharpie gel pen certainly unique think buy try smudge resistant uni signo pen well feel like generic pen buy work special uni ball eye fine super inky smooth tend soak paper like permanent marker smudge lot
0,problem ohto ceramic refill recently receive ohto feature highly acclaim ceramic refill mm arrival refill dry replace refill week later replacement start dry problem refill unsure bad luck replace time look switch gell refill
0,look suggestion ballpoint refill currently ystudio glamour evolve bihex rollerball pen rate schmidt refill love hear alternative thank
0,week jotter big hand love
0,know pen
0,mm needlepoint clickable suggestion appreciate thank
0,pen eds need new pen eds friendly maybe large grip like one specifically eds ink quality good preference quick dry ink small nib recommendation appreciate link extra appreciated
0,npd think purchase get little hand continuation look uni powertank pen look like get little hand time get uni vision elite
0,pilot precise rt needle point gel pen feel bit different precise cap stick pen hunt new pen currently energel mm energel mm prefer gel pen pilot howeve memory uniball vision uniball roller high school recent use precise stick bic look roller ball requirement pen look nice basic stick pen precise uniball vision bic goal nice pen know high end pen pilot refill precise rt refill form factor buy rt refill feel like needle point gel pen instead needle point roller ball right assessment search google fail find good straightforward answer
0,kaco refill work jotter buy kaco refill jotter work click pen stay return closed position frustrating help appreciate
0,suggest person enjoy write fine tip techno tip hope people india relate current favourite experiment lot pen love fine rollerball pen fountain pen suggest guy limited budget
0,go basic super fountain pen game forget ballpoint rollerball pen thing go rabbit hole fountain pen glad able enjoy equally rotate pen liking carry want want pen get hook look feel pilot sheer look material get hooked glad able insert zebra rollerball refill refill hand
0,tombow zoom rollerball pen refill refill fit pen tombow bk rollerball pen refill
0,enjoy think find sub look great gift sister love pen lot huge collection see good look pen go parker jotter monochrome rose gold end take pen zebra lay desk kind take collection love buy self zebra fall love heartbeat parker jotter black ballpoint today spend good hour raid testing maybe keep gel pen collection wait order different gel pen refill trusty run quick buy sharpie gel metal replace take good pilot pink find end grab treat stay hobby think maybe danger need good recommendation gift cool pen raid collection list zebra parker jotter black zebra uniball signo sharpie sgel field note yes
0,mark refill track usage habit mark ink level refill easy quickly ink
0,search needle tip low flow blue clicker cap pen know agonizingly specific exist right education fill form document microscopic box chart demand extreme precision pen crazy thick offer detail drench paper ink feel good bet pen needletip mm low flow consistent blue clicker cap pen literally ask lose environment come close meet blue clicker criterion simultaneously unfortunately people steal pen like crazy have blue good prevent thank advance fruitlessly spend money time store try find avail
0,npd
0,pen identification japanese brand
0,fisher space refill zebra hello lot people talk fisher space refill good refill zebra know specific refill people talk let know check thank
0,well recommend pilot compatable metal pen pilot time favorite pen think upgrade look metal construction pen little short pilot yes know pro limited version like brand call smooth pro amazon recommendation
0,playboy pen ad
0,pen model hi know pen holiday buy pen souvenir shop lot ink run try look pen model buy pen say uni jetstream try search lot option classic sport different size idea model thank advance
0,great micro pens allett sport wallet hey want pen allett sport wallet company sell wallet sell micro pen size mm mm pen secret pocket wallet well pen fit
0,new jetstream ink pen comment pnetmon mention refill hear digging accord company new ink jetstream lite touch lite touch ink new ink reduce write resistance conventional product provide smooth writing experience addition improve ink blot paper slippage provide stress free stable writing new option jetstream bear write drawing scene diversify depend time paper quality condition ball slip difficult write edit fixed attribution
0,good place pens personalized business good company pens personalize promotional giveaway good pen model
0,favorite pen
0,help identify wonderful pen enthusiast help fins pen waiter hand partner love find maker mark cap thread hide loose spring inside helps maintain constant pressure
0,indiana statehouse pen senator garten use
0,high end ballpoint pen think use expensive ballpoint pen worth spend money ballpoint opinion jotter sentinel job perfectly
1,neurographic portrait hongdian sailor pgs shikiori manyou fountain pen ink visconti green sailor studio
1,recommend fp friendly paper practice write chinese character go post chinese language reddit question niche learn chinese know handwriting essential skill nowadays like learn see people like paper like grid size character write consistent make sense imagine similar product japanese handwriting work
