subreddit,processed_text
0,uniball obsess send help pic cherry papaya banana la france rise gold clip mint soda peach milk coffee yogurt rise gold clip pic white tea savon lavender peony new collection miss grape mandarin color purposely tone clash harshly rest color decide skip chunky baby sweet issue skip like read people size shape appealing definitely collect new color release
0,new pen day acquire facebook fanpage tactile turn thick titanium bolt action short version seasonal release pen big fan see offer bolt action thick diameter titanium want try impression feel good hand notice difference thickness right bat bolt action smooth fidgety refill monteverde broad tip mm figure need thick broad refill thick pen man match heaven quickly favorite refill dark wet broad line feel like writing feel tip marker fast dry time smudge important consider lefty
0,recommendation birthday gift hi friend birthday come like nice pen gift know enjoy write use know pen figure folk able help passionate faq kind post subreddit rule apologise feel free remove context friend male late mention enjoy writing poetry lyric aware write long form time time like nice reliable pen use long term mainly hand writing guess dry quickly easily refillable minimal hassle good think detailed drawing know like doodle lot think relevant budget wise usd know pen unreasonable feel free post suggestion thank read help appreciate
0,modest collection nice pen
0,favorite reliable pen know fail curious shtf pen guy personally pentel energel alloy daily driver bic shtf
0,uniball jetstream smootherpro hybrid exciting day try different ballpoint come admire jetstream uniball reason think insert lovely brass smootherpro try straight fit pilot cartridge feel scratchy perfect hybrid common knowledge win
0,pen need silver black ink black chrome blue ink
0,parker not find model online
0,recommend style pen body love schmidt easyflow refill bored jotter look new pen body look barrel little thick parker jotter ballpoint pen waterloo blue medium point close ballograf ballograf epoca ballpoint pen medium point olive green little stylish recommend
0,tony stark pen iron man identify think cross multi pen twist mechanism refill perfectly semicircular dome shape metal stylus cross pen usually taper conically end ink rollerball blue waterproof thank help provide watch movie year ago remember pen finally ask
0,pen haul
0,look ball tip pen exist lol able find fineliner like micron prone accidentally damage tip look new try ball tip exist small available ball tip pen
0,bolt action collection current favorite edc pen bastion stainless steel cool hand brass bolt action pen heavy prefer heft
0,nmd new marker day ti marker marksmith
0,tip replacement pen ink tip go dry long usable replacement screw
0,type pen use schneider topball refill inadvertently buy box schneider topball refill realise pen fit refill recommendation greatly welcome preferably thank advance
0,npd inventery bolt inventery bolt size take parker refill schmidt swap ohto flash dry love conical nose needle look
0,know kind pen hi recently inherit pen grandfather crossword pen parker ballpoint recognise exact model grey area pen extensive use haha thank advance
0,small light pen
0,absolute favorite pen like ballpoint see convert ballpoint feel tip
0,look identify kind refill pen information brand refill try work base ballpoint tip square refill find circular example pilot refill perfect size base ballpoint tip circular fit way
0,pen identification help skagen know type skagen identify cartridge thank
0,find pen worth thing person actually strike rich tldr come sub unidentified pen turn worth thousand notice immediately join sub multitude reason sub get proportion find pen worth posts funniest week firm receive pen friend dead dad want know value sell geeeezus haha sub flashlight sub belt sub think general person use see bic pen think average person romantic antiquated perception fountain pen particularly point people life purchase pen end junk drawer find year later honestly sure people think wow bet worth find pen haha
0,help identify old pen
0,sharpen blunt sharpie tip myth sorry wrong place post spend well hour google find post revive dead dry sharpie iso alcohol go try trick sharpie interested fix sharpie tip hear fix blunt sharpie tip sharpen inform totally believe sharpen blunt sharpie tip knife sharpie right feel pretty stupid right lemme tell xd google thing hour get decide try feel dumb take min gingerly apart sharpie ink find piece inside get messy tip tip easy pull plier take apart get apart paper towel hold tip whilst sharpen razer think likely suck ink felt bleed stain finger anyways try alcohol trick later overly confident reassemble sharpie look like total crap totally wonky pretty sure tip push pull actually write realize sharpie properly assemble tip way sure pull attach pic sharpie tip hear tip feel pretty stupid right believe try totally fake try pull tip bluntish put sharpen update result tip look zoom like look like bad thing sharpen pretty stupid look assemble sharpen product look pretty ridiculous sharpie properly
0,best small point pen note writing look new pen note taking like small ideally wonder suggestion thank
0,uni biz alternative refills look nice multicolor pen find uni ball biz like design fond erasable ink school allow know jetstream refill fit pen normal refill
0,energel refill fit uni boxy look purchase uni boxy ballpoint pen tip love design fond ballpoint dozen bullet tip energel refill confirm energel refill compatible boxy help greatly appreciate
0,love brass start peek rotring year use roll purse
0,pen identification suggestion similar pen alright unidentified clip cap entire decade entirely silver year wear need wrench tip mean ton brass show completely forget get point discover misplace bit recently exclusively write thing college mean vast majority lifetime notetake particular pen legitimately write quickly pen actually entirely sure honestly kind want find similar actually lose notetake speed hit type step tip taper see draft pen want similar tip take generic gel refill like refills needle liquid rollerball dp incredibly cheap write probably care body diameter mm tip diameter finger mm profile step cylinder instead have cone tip prefer metal pen use solid suggestion
0,thought bic cristal pentel energel daily driver honestly tier pen amazing school note know gel rollerball ink smear super accident water week nearly ruin page note recently pick pack bic cristal pen important note outdoor stuff smudge easily nearly waterproof write brief period honestly smooth impressed medium ink day thought bic cristal
0,know pen brand pen find free good find brand
0,pen oil water base ink
0,pen go sheet paper hellooo tell title search pen easily sheet carbon copy paper write lot job nice way push page visible hand definitely hurt yes try sharpie pen prefer non smudge able suggestion appreciate thank
0,good non retractable pen use exam look non retractable pen noisy one write retractable pen like uniball jetstream pilot supergrip lot noise distract people specially exam silent good pen non retractable thin make hand cramp
0,pentel energel good gel pen write beautiful letter well gel pen read post compare pentel energel pen pen pentel energel smooth well color etc general article good gel pen beautiful handwriting compare individually say good pentel energel good pen anything well recommend thank
0,find set clean grandfather house tell sell need money remarkable pen collection case appreciate help
0,colored energel infree want infree find place violet energel xes sell cheap infree major difference ink flow longevity etc
0,know pen
0,bright neon green permanent marker cd record cover look advice quality bright neon green work glossy stock cd cover vinyl record sleeve good success metallic sharpies feature color look regular sharpie ink dark stock help greatly appreciate
0,schneider gelion refill look get new pen edc use look use schneider gelion refill regular parker pen ballpoint refill alternative get refill parker pen appear lose pen look new option refill interchangeable good budget bolt action pen pen collector want write parker refill
0,print pen snap unscrew quarter turn
0,recognize brand hello dad pass away couple month ago find pen store away like year ago old waterman montblanc anybody idea quality brand pen special thank advance
0,help find refill staedtler initium lignum rollerball hi gift staedtler initium lignum rollerball pen dear friend year ago misplace refill confused particular refill purchase understand pen come fountain pen afraid clumsy writing wooden body stain ink
0,different variation parker jotter clip year cool parker change clip overtime iconic classic click blue year year idk new modern black ai date code red pe date code ss version ui date code
0,erasable gel pens get erasable gel pen take note unfortunately ink consider light erasable quality useful time nice note
0,pilot vs uni ball pilot user year high school post graduate study recently see newly release uni ball internet wonder worth currently review comparison pen opinion
0,best budget friendly gel pen nib tear option pentel energel clena vs pentel energel vs pilot juice vs zebra sarasa consider characteristic pen suit write lot school day consistent writing build dry ink nib long writing barrel aesthetic color plus esp orange ink available thank suggestion review deeply appreciate
0,vintage parker clue old dad find old closet year old know price maybe stand uk text cap
0,help identify pen grandma give cross cartridge fine find detail exact match online market lady pen think wonder know model imagine worth like write curious
0,good pen hi journale year month ago get lot jot line time month write page week notice stand usual pen reference uni jetstream favorite pen start write lot amp frequently ink skips amp stop couple letter scribble ink refill act way recently get muji pen come mm tip write small tiny tip help love smear water like stop asap archival ink important use notebook personal reference klutz pilot juice come mail write find permanent replacement hope suggestion stop buy plastic pen go use look small extra small tip size waterproof water resistant archival ink refillable body reduce waste amp skip second open rollerball gel amp fountain pen little experience explicit detail suggest long steady flow thank edit great multi pen recommendation use commonplace give
0,st dupont pen id father pass away week receive mb meisterstuck mystery st dupont ballpoint help ide greatly appreciate thank
0,happen pen energel
0,print pen use pentel energel refill
0,small pen tip available see uni ball signo mm able find currently micron mm art style require small pen tip able find small comment link dm
0,gel refill dry open good morning order refill way wonder energel refill dry open use switch go use black blue red couple color like try idk use daily length time want open use let dry experience thank
0,pilot pen cartridge fit title
0,custom pen search high quality custom imprint pen dollar unit djb pen like stuff alternative company check mainstream one low quality
0,get tritium tibolt super excite tritium part come zirconium tibolt yesterday wait decent shot
0,cute barely pen notebook collection know compare collection think post see
0,suggest pen anniversary gift hello want gift boyfriend pen personalised engraving idea pen browse decent time reddit website select pen skilcraft aviator like cause think add meaning pen caravan fisher space pen want know possible engrave quote skilcraft aviator recommendation highly helpful thankyou great day
0,npd kaweco infrared perkeo
0,hate zebra zgrip ballpoint pens pens seething have moment ink refuse come spot paper curse paper cos zgrip pens cant write theyre sooooo inconsitent cant write single thing honestly big disappointment love zebra pilot pen
0,get vintage jotter get vintage uk jotter ebay find modern jotter misplace year significantly different click satisfy blue ink black
0,buy beautiful pen amazon alot fun pretty write
0,muji pen metal body hello recently buy mm muni pen wonder compatible slim metal body pen want refill metal body different smoothness thank
0,classic simple
0,good gel pen improve handwriting note take student practice writing print know gel pen choose people zebra sarasa mark dry good gel pen people pentel energel pilot wonder pen choose hope help choose right pen practice serif font addition list factor choose good pen practice handwriting general serif font particular thank answer
0,april test run switch common office gel pen favorite zebra team meeting pack fine pen
0,look pen similar quality running ink pen ignore content lmao find nearly ink pen wonderful rough draft love faint thin quality line let sketchy messy grief pic normal pen reference pen naturally quality
0,journey custom pen knowledgable folk recommend parker pen insert fisher space pen insert ball point guy need pen ink smudge stay wet
0,help find pen
0,fisher space pen alternatives wallet elastic strap perfectly sized fit fisher space pen love size form factor space pen like way write pen aficionado feel like take pressure line wide honestly love write fineliner gel pen fine tip far tell fisher sell cartridge signature pressurize make sense company sell type pen form factor maybe party cartridge compatible space pen body
0,porous pen like like pen type shape excellent recommendation recommendation porous pen like stabilo sensor example good recommendation staedtler fineliner like brand like sakura pigma micron favorite popular think type pen
0,help identify pen like buy pen give find help greatly appreciate
0,pentel good pentel
0,idea fineliner
0,faber castell run super quickly
0,good steel pen find temu start pocket notebook wonder temu good steel quality pen
0,help id remember life pen american company remember correctly buy year ago end mahalo help
0,paper mate handwriting alternative source hi team look alternative source paper mate handwriting pen love thick hold ideal short stubby hand write smoothly production amazon triangle grip version deal prefer find original bonus point ship canada
0,parker pen love parker pen get gift anybody know buy
0,new pen happy sweet
0,store pen see post pen storage thought new share use fiancé travel lot super hard combine pen amazing pretty pricey online find ross sale michael score come super handy have constantly pack road pen count insanity obnoxious pen bag fill brim recommend originally photo storage average pen size fit perfectly
0,lamy balloon rollerball pens
0,pentel good
0,long pilot style pen pilot long time probably year favorite wish like inch inch half long know pen feel similar little bit long
0,pen dental composite tube pretty happy dentist perfect interesting clinic lol
0,good promotional pen promo pen bridor fancy baking company
0,like literal addiction
0,help pick cross pen send gifted pen repair instead give credit know pen think opinion want pen write kind paper consistently essentially work horse daily driver tia update buy click ballpoint edge gel rollerball refill thank
0,best pen autograph pen recommendation autograph particularly pen good write glossy poster print convention meet celebrity bring commission artwork sign usually autograph paint pen smudge image look come variety color get pilot multiball pen deliver work gloss poster paper come black blue look come metallic color silver gold bronze etc standard color like red green purple etc similar pilot multiball come color
0,identify brand pen try determine brand purchase refill rollerball pen
0,pen identification know lamy pen know
0,look buy set ebay set authentic professional
0,durability fisher black titanium nitride coating experience coating pen coating stand test time ask consider fisher infinitum specific coating want
0,look repair parker duofold godron twist mechanism hi everybody anybody great tutorial repair twist mechanism parker duofold godron ballpoint pen thank help
0,curious question curious purchase ridge brand pen worth like well pen half price love lamy safari
0,sure brand find box pen write smoothly balanced remember get probably use metal like sensation diamond cutting end
0,new pack pen wait try
0,sarasa vs pentel energel confused choose right pen sarasa pentel energel right handed care dryness simply want find smooth pen look choose sarasa pentel energel confused choose great compare well pen model recommend thank
0,tombow dual brush pen swatch experiment
0,energel skipping hello enjoy pen find feather bit liking switch energels issue far skip recommendation fix feathering issue pen skip energel write peter pauper press notebook use gsm paper help think try kuro think fix skipping look nice chonky regular energels
0,pen clip review traveler notebook accessory pen holder medium olive stable fit wide variety pen look subtle
0,pls help identification pen help identify pls tell usually price thank advance see post mercari read japanese lol
0,npd titanium refyne bolt pen awesome decide clip clip swap refill ohto flash dry guy think
0,know birthday tomorrow want spend birthday money receive edc mother think unwise spend money writing utensil advice convince
0,find garage sale today not know rollerball pen buy frank lloyd wright design good
0,disappear pens day lose love pen think steal pen nope scratch positive steal pens happen everytime friend testament go crazy ballistic pen miss swear god pen go miss hostage class find trace footstep hunt retrieve pen
0,schneider business roller ball opinion pen think buy
0,info pen great find google
0,pen actually smooth buy pen try smooth suck feel like write needle hold pen tight grip help like union signo jet stream option
0,identification amp authenticity hello hope wonder information pen model year research find similar idea pen authentic naked box paper thank advance help nice day
0,recommendation purple pen fit mm pentel energel refill currently enjoy write bordeaux purple zebra sarasa clip gel zebra sarasa clip gel mm vintage color bordeaux purple bordeaux purple zebra sarasa grand gel zebra sarasa grand gel mm vintage color bordeaux purple mm pentel energel refill love want ask recommendation nice looking purple pen fit mm pentel energel refill one ergonomic grip particularly welcome thank advance
0,find beautiful pen alfred dunhill information specific design ve find design fountain tip
0,selling pen small collection quality unusual ballpoint rollerball reddit sell try heavily focused fountain pen get interest
0,bic colour hard find rare live think bic colour hard find store live colour common brazil colour hard find especially physical store internet easy buy opinion
0,edc pens mention post power tank pen fact year love pen try tombow size design thing great important way write smooth thick liking wonder tombow popular
0,mars professional refill
0,question jetstream pen stans hey uniball jetstream fan significant difference jetstream rt pen jetstream pen try rt pen workplace find scratchy fine point crappy work notepad horribly cheap paper know sure pen fine point medium point feel like bold point prefer stick retractable pen contemplate try stick pen writing experience medium point similar rt use cheap spiral notebook work worth give write rt pen
0,find ferrari theme pen license ask teacher get packaging find ebay listing difference find google resemble ebay listing die know pen good guess rare rare point exist internet help appreciate
0,happen pen remember uni ball vision rt miss store shelf provide information availability discontinue alternative recommendation appreciate
0,pen finally find pen actually ink get refill plan absolute pen work pentel energel mm
0,kleid mesh pouch good morning try decide pen case mini pouch look dimension wonder experience predominantly lead eraser ink refill throw odd pen pencil rotate space look like pocket moleskine fit exterior pouch mini size insight appreciate
0,good pen dusty enviroment work oilfield caliche dust wind wreak havoc tight tolerance pen clicker currently pilot pen near end life tend feel grainy sticky click deep clean week run ink well pen writing dusty enviroment prefer gel willing non gel
0,pentel refill find pen home model pentel find ceramicron refill online brand produce similiar
0,pen cup nezuko mighty demon uni powertank great upside writing couch uni propus hilighter use cup kid steal visconti rembrant rollerball ink nice navy blue crappy replace energel refill pentel energel good disposable energel body separate clip clicker crack middle uni premier real comfortable alpha gel cushion writer currently energel refill uni jetstream edge away team pen sign document end sign contract crappy generic ballpoint salesman happen desk pilot timeline gel cool double knock mechanism point wobble come fancy version gel refill chop signo uni roller sharpie need say uni kuru toga dive great technical achievement pencil uni kuru toga alpha gel real comfortable pencil
0,uni ball signo mm refill struggle find mention online wonder mm refill compatible plus thank
0,parker build similar problem parker quinkflow mm france normal office store staples
0,store pen use acid free comic board big ziplock bag
0,uni power tank easily good writing pressurized refill compare fisher space pen schmidt megaline tombow airpress zebra wetnie power tank write jetstream paper remarkable feat pressurized refill zero skipping railroading impressive wonder impressive pressurized refill pressurized refill tend use high viscosity ink make writing experience paper smooth require apply pressure black ink saturate comparable gel pen black jetstream black downside power tank mm come blue black red odd reason mm blue refill thicc popular machine pen tactile turn spp autmog big design etc fit thick refill needless cut refill short length find single pen body fit refill tldr want pressurized pen write paper good option long mind black able use refill pen body
0,solid japanese pen rattle hey get recommendation solid japanese pen ballpoint preferably metal zero rattle get ohto rattle kill slowly rotring mechanical pencil loooove solid feel weight zero rattle recommendation appreciate thx
0,eraseable pen ink permanent hey guy love take note pilot frixion read mark page write quote etc finish book note love permanent erase think moment week later wonder pen ink permanent time way frixion permanent def cool stick freezer soemthing permanent wait day thought idea
0,montblanc ballpoint budget want carry mb love ballpoint ink try hack need monblanc ballpoint refill zebra sarasa white label parker style refill setup year issue
0,good medium high end lefty pen hi trouble cramp write life smudge aswell look good solution finally write enjoyable price matter refill easy gel ballpoint mind thank lot advance
0,pilot pen kyōto tokio hey guy have hard time try find pen kyoto tokio particular pilot spare sign pen clear anybody suggestion find cheer
0,fountain pen shape like kuru toga dive sorry wrong place post fountain pen shape like kuru toga dive mechanical pencil thank advance
0,get fountain pen
0,need new rollerball edc pen love cap will stay anymore cross know model think lamy match lamy fountain pen idea suggestion like
0,recommend waterman hemisphere essential
0,syd pen new design come soon kickstarter website
0,security ink check washing day transaction digital fun want uniball super ink add pilot result sock acetone gel ink like
0,black ink reference want quick comparison zebra jf mm pilot refill refill open try figure time impression nice dark line definitely broad point mm wet writer downside bit smearing dry touch second leave hand accidentally smear time monteverde mm parker style refill buy refill blue black ink try plain black impression wow talk bold broad line thick line zebra dark deeply black ironically dry fast zebra crazy consider thick dark line put down recommend look new refill reference tactile turn ultem pen short version
0,explore different types pens
0,look small travel pen recently lose fisher space pen travel pen debate pick bag travel house look option requirement small durable preferably pocket clip relatively easy acquire refill budget major concern reason afraid spend money good product run pen lose moment debate space pen kaweco liliput curious favorite travel pen recommend
0,npd modern fuel stainless steel bolt action pen clip champagne tactile turn force patina slim click pens
0,know brand mechanical pencil
0,pen offer line variation know fountain pen want google stuff think secret
0,look specific pen intresting cap design hello look pen particular cap closing design understanding pressure fit believe cap prong interlace rest body twist motion open close know pen kind cap leave comment
0,fail research sub decide pack precise mm pen blue pink one absolutely amazing unfortunately black purple one set barely let ink despite stop store spot sure wrong get unlucky faulty thought case look new recommendation note taking keep mind like functional one set bic slide thank
0,good pen problem break pen usually buy bic horrible habit lose break good pen recommendation
0,cap metal pen recommendation look new pen replace lamy lx rollerball unfortunately lose like pen think decide shot need body fountain pen pen post recommendation appreciate
0,pen identification make pen love weight feel good thank
0,st dupont ballpoint refill find beauty flea market ago buy wonder help find refill thank
0,uni ball signo lot lnow difference thing care smoothness consistent line help
0,identify pen rotring
0,identify know bendy theme
0,grail pens otw boyfriend want replace pen steal year birthday week tell order place split want work set super excited zirconium trit size tibolts kryptex zirc trit clip picture axel wavy copper copper fap cap tip copper bolt zirc handle zirc clip flute ti zirc fap zirc bolt handle tuxedo clip
