subreddit,processed_text
1,traveling journal fountainpens approve moderator greeting fountain pen family see original post propose pass journal new project read thrilled announce moderate team generously agree support assist ambitious undertaking great deal interested party room like project read outline instruction extremely excited move look forward amazing entry traveling journal fountainpens sub compose unique individual view experience talent creativity unite shared passion remarkable writing tool fountain pen capture uniqueness single tome sharing preservation plan straightfoward physical journal send member person add new entry typical journal diary type write entry lyric favorite meaningful song movie famous quote artwork feel like contribute periodically send archiving send member continue chain journal fill restriction add detail procedure take project fairly simple join sign submit info google form create mailing email address reddit username create free account require highly recommend save subscribe thread public update personal info share purpose project additionally member address info previous contributor help maintain privacy security asana account asana project management tool allow track journal communicate contributor serve way effectively efficiently move maintain privacy possible good sized list contributor sign organize address journal stay country region long possible help save shipping cost rule sign project dedicate mind timely nature project reasonably prompt entry forwarding journal understand small financial requirement form postage responsibility send internationally cost minimal familiar shipping price entry shall defamatory disparaging overtly vulgar harmful hurtful overtly vulgar mean use cursing refrain nude artwork thing nature basically add consider trashy romance novel fine art nude thing porn completely deface alter person entry ideally great addition entry list moderator agree violation rule repercussion contributor membership sub journal look feel suit project torcello firenze papuro open suggestion completely different journal requirement decent reasonable size cm large sheet total page unlined especially purposeful artwork leather fux leather cover aesthetic reason mention journal periodically send archive case unthinkable happen journal get lose damage ultimate goal create ebook sub member able project moderator support question concern let know hope move soon wait result want thank pandavictus help way edit wow signup look like able forward soon objection soon move forward purchase journal list thank support little idea
1,need simple reminder
1,confess wrong kaweco hobby decade especially lately own lot different pen lot different manufacturer know kaweco popularity sport variant think ugly uninteresting pen call metal tampon couple week ago resin pocket pen start get crack guess brand decide find replacement pocket pen metal lot people recommend metal version kaweco sport open mind bit ultimately decide try cheap hongdian like lot fantastic pen day happen notice kaweco brass sport sale fine nib bite bullet order carry day far absolutely love build hefty heavy solid feeling feel like indestructible tool nib gusher probably ideal pocket pen great paper smooth writer weirdly comfortable hexagonal pen feel like quality convert yes like probably rotate edc pen nice
1,cheap fountain pen well cheap pen zero problem expensive one like kaweco conklin problem nib smooth
1,literally classic design beautiful stripe engraving nib color
1,npd sailor nib buy impulse straight japan sailor realo nib review correct feel like write pencil ahhh
1,weird hat note try asvine extremely smooth nib smooth custom albeit write thick surprisingly great qc drop table completely fine scratch piston fill store lot ink course feel shockingly solid build hand resin pen come beautiful color way buy amber medium nib fast guy draw hat nah trippin want draw like
1,yay ink diamine honey burst scribble purple alt gold grun land today lovely far great value
1,sailor collection far bonus twsbi diamond find hand feel nibs sailor pgs series comfortable buy jinhao nib stiff want regular pg different pgss love
1,new pen day electroc boogaloo
1,glitter galore local webshop sale buy pelikan edelstein golden lapis new twsbi eco dark sapphire think emerald chivor lot glitter wrong ink pen golden lapis golden glitter will clog nib feed
1,office
1,feel sad ink get discontinue
1,robert oster sun snow get time swatch ink sucker gold shiny thing saturate ink show visibly paper shading ton shimmer
1,chocolatey goodness hello kobe ink sweetness know city museum gray know confectionery range believe chocolate ink collaboration felissimo chocolate museum ink colour base theme chocolate chocolate chocolate like caramel milky brown beautiful pink shading chocolate soft rosy pink slight purple pink shading place city museum gray haul nagasawa decimo kaigan stone gray note swatch heavy colour chromatography feel ink look lovely broad nib ink swatche endless recorder trp kakimori brass dip pen ig ameizingplans
1,ink diamine twilight diamine asa blue randomly mixed diamine twilight diamine asa blue impulse straight twsbi ecot look like bluer version iroshizuku ku jaku
1,print accessory
1,struggle use collection long time bullet journaler collection purpose life complicated new kid new house new business switch electronic note task management unintended effect switch drastic decrease fountain pen usage rectify try morning pages month jive fountain pen relegate haphazard note weekly club meeting make sad look suggestion advice well habit collection thank advance
1,like mimic expression moment
1,love stub nibs stub nibs lot fun great ink property need slow writing bit add pressure line variation conklin jowo nib good flex swappable unit waterman carene stub great stiff inlay nib razor sharp horizontal experience stub nib
1,new twsbi dig know dig price tag
1,pilot dry update update previous post realise edit brand new pilot heritage suddenly run ink mid sentence get lot good advice clean pen thoroughly drop venting process nib point approximately position suggest retailer time try procedure work long finally give rinsing warm water fill reservoir warm water little dish soap let marinate minute rinse multiple time work fine knock wood write like page nonsense listen scary story youtube show sign dry hand tired stress testing wait till later
1,npd asvine
1,npd amp nid faber castell grip glam amp améthyste de
1,esterbrook transitional dubonnet red freshly restored era esterbrook transitional dubonnet red large model restore replace ink sac cleaning buffing replace mangled nib highlight brand logo great pen write wonderfully venus division esterbrook nib assembly direct fit venus broad smooth nib stub like beautiful mackeral pattern celluloid come life good hand buffing sunshine cloth beat good fountain pen pen esterbrook transitional size dubonnet red nib venus steel nib broad feed stock venus feed fill system lever filler ink sanford pen peacock blue paper rhodia standard rule cheapie notebook
1,npd asvine continue enjoy asvine product chinese pen purchase hit miss look jinhao pen purchase far asvine great like build like nib medium like weight smooth nice wet course beat price know well think pen asvine come today continue trend finally dud
1,current rotation think finally find rotation like jinhao parker blue black jinhao diamine green black jinhao jinhao black jinhao diamine oxblood work pen perfect work pen small light inexpensive fit pocket perfectly plus break get lose fix replace get blue black ink heavy good looking write beautifully extra fine nib favorite like ink pen everyday pen couple month straight great workhorse leak complain work pen black ink pen work pocket jinhao parker duofold grail pen eventually current budget great substitute write buttery smooth ink forever alot write pen use time ink colored ink let creative usually new color pen take year buy try different pen team recruit collection will waste go collection pen work karkos ink color drawing stop buy pen
1,npd jinhao like jinhao lot enjoy write nib small term look intention nib replace kaigelu planning replace goulet nib small family big liking like nib size reason prefer nib remind platinum writing experience kind think nib jinhao good nib hope jinhao improve nib everybody like supersize pen thought write photo nice weekend ahead
1,second hand montblanc
1,troublemaker dona victorina high hope advertise purple gold sheen aaand course leak
1,new ink amp new pen day endless alchemy candy sea jinhao shark pen
1,laugh find day planning color coordinate rotate work guess like lot color
1,paint wear
1,shade teal people garden clean house exercise relax reduce stress swatch ink
1,new pen day travel recently realize like mini pen easy bring carry pocket get try affordable happy far pic cap post get loose leaf iroful paper try smooth
1,game hello fellow redditor fountain pen game want share experience concern pardon english native speaker germany learn cursive elementary school fountain pen lamy abc mandatory day fact mother handwriting bit calligraphy super exit fountain pen write pencil small blackboard pupil carry crazy time get lamy abc get engrave enjoy learn use fountain pen handwriting pretty bad wrong kid teacher read handwriting like way handwriting look improve boy nowadays identify social gender love use thank pretty good readable handwriting time change writing device grade get mirthful online ballpoint pen handwriting truly ugly readable year later lamy safari handwriting change time try find style experiment lot handwriting good pain arse find fall love parker jotter absolute favourite roller pen freaking lot special edition pretty like way handwriting look jotter good handwriting able produce fountain pen device admire decide buy good fp go local stationary shop try lot pen lamy faber castillo pelikan try jotter pen okay light slim end waterman hemisphere suit handwriting improve go university freaking lot handwriting think time jotters comeback year rollerball writing decide time new fountain pen order leonardo officina italiana momento zero sorrento blue amp gold stilo stile opt broad nib look pretty medium writing example broad think maybe try new fp like hell arm hand hurt write page past year freaking rollerball ruin handwriting muscle memory like learn write fountain pen second time handwriting look awfull chance improve handwriting hard work game
1,get to man channel inner huell see come resist
1,purpose pilot metro amazing writing experience lamy safari feel sturdy jinhao ink forget kaweco sport fall love pocket pen kaweco sport al pen life expensive parker vector super smooth reliable pilot metro dry lot majohn convenient pen use want end honestly search
1,find fountain pen need help advice receive fountain pen photo brand marlen year ago start decade decide try stumble issue know type fountain pen sure cartidge type install able unscrew barrel hope able guide advice welcome
1,vpd stunning waterman lever fill
1,neurographic portrait pilot lamy safari fountain pen ink sailor studio herbin orange indien
1,stock head pasco wa sagefen makers fest
1,buy pack biscuits amp thing come mind lamy blackberry amp cliff inks weird
1,lamy calligraphy pen lamy calligraphy pen wife gift know magic pen hand hold
1,pilot pelikan platinun love kind small light good pen little bit ooomff huge bit large body nib heavy need killer new pen amp decide
1,favorite orange pen ink hello friend eye conklin american sunburst orange pretty pen feel disappointed read great review nib quality love good orange pen fun orange ink favorite
1,cat fantastic cheap paper sport nib
1,love magnetic cap nib swap pineider twin tank platinum soft fine visconti mirage mythos visconti hs nib medium cursive italic pen great chef kiss
1,pen show scotland aware pen show scotland scout find wonder fly radar hope organise soon love pen
1,add collection pen collection buy receive new pen year want year decide nib
1,pilot heritage dry mid sentence get brand new pilot heritage fill waterman serenity blue reason dry write line try refill thing problem pen advice
1,pen pal write long weekend digest friday sunday sticker ink iroshizuku asa gao lamy bronze need comfort food notice write
1,kaweco sport grey
1,got benu nahvalur visconti mean go stop buy ink
1,wait happen like love look ink paper try use possible waste away time new version software busy validate file load purple waterman tender purple green diamine meadow blue diamine spullen amp rose red diamine puppy red yellow diamine amber orange pilot iroshizuku yu yake
1,haunt pen experience year attend pen new fountain pen experience spend lot time browse touch ask question buy get pen ink notebook course later come sub yt find buy way way vender actually say buy nice funny way feel bad vow save spend year support vendor morning dream find vendor kind buy stop think year give set want spend pen ink paper trouble go visit hong kong tokyo summer pen september plan store want visit pen want check wonder money leave pen increase self impose budget year set limit trip
1,planning work project cursive practice hey today get use dot paper plan work project pretty sweet grant crappy printer paper print pattern turn think work cursive mean good write fluently elementary school wingsing ink pilot iroshizuku kon peki pen nice find sweet spot like pen rotate line thin problem paper ink pen combo bleed make fine line hard reverse write nib scratchy want long think dotted paper think try journaling practice cursive writing use wingsung like finally experience nib have sweet spot problem
1,new pen zip case galen leather
1,tell rohrer amp klingner ink lot ink year occur try rohrer amp klingner maybe time order review ink reliable place like look firsthand opinion interested standard ink salix sketch line experience tend like ink wet subtle vibrant minor shading little sheen actual writing care swatch drop
1,lovely new ink day totally fall love sample ink buy bottle pretty
1,companion love hobonichi week unfortunately limited space write tthe task main planner annotation book love size texture page day ago discover light weight insert refill tomoe river
1,gold nib hey want buy gold nib gift get good music school year eye pilot elite price increase sure worth look gold nib option range reference favourite pen pilot prera majohn sailor compass not like heavy recommendation europe exclusive pls
1,npd moonman try nib fine believe fine line smooth order big fan faceted body person truly pretty include nib smooth p increase ink flow nib
1,falcon nib question sm nib broad taste need help decide replace sf sf unflexed line happy get bit confusing nib pilots perfect falcon sm wide nib sm nib wide falcon thank
1,buy printer thing print fountain pen display lamy collection love way look
1,thought sailor lecoule want try sailor pen sure want drop good chunk change popular one thought lecoule hear mixed review not know worth sailor pen difficult find locally area find lecoule profit casual shikiori kind want hold buy expensive sailor pen go japan month university thing find advice helpful reference enjoy pilot metropolitan daily use pen
1,experience shibui north pocket fox currently love design currently shibui north website titanium pocket fox pen think get commemorate milestone hit expensive pen budget bit nervous buy price try wonder people talk experience pocket fox maybe compare term thing like size weight write comfort pen cap seal durability ease clean experiment variety beginner pen different brand right favorite use probably twsbi eco lamy al star pilot kakuno amp hongdian forest amp small pen probably close comparison fox pilot prera jinhao old sheaffer school pen hongdian try kaweco sport store quick search sub shibui post see celebrate new pen wonder experience use thank
1,popular opinion fountain pen people love awesome
1,stuff pen lamy studio ef steel ink lamy dark lilac pen write fine occasional debris tip problem know goulet say shimmer like knowledgeable come ink explain great problem curious hard clean like ruin right
1,buy japan ig retailer newer usa base fp buyer think purchase japanese ig retailer like izumi goodpenlife wonder experience folk buy reseller common use paypal facilitate transaction ems shipping excited japan edition expand pen collection thank advice
1,want pen buy get accept master program
1,new ink day love tsuyu kusa shame discontinue
1,search blue fountain pen silver trim want recommendation blue fountain pen silver trim normal blue turquoise thank
1,blatantly obvious fountain pen ripoff see irl
1,ink inspiration hiii write similar post near future main object post ask favourite ink live name od big fan think everybody consider try start iroshizuku sumi favourite black moment formal intense robert oster signature tokyo blue denim fun shade blue iroshizuku shin kai consider blue black dark blue robert oster signature direct sun deep red hope kind post want learn share hobby sort interacrion weird hope interesting thing coments
1,finally get pro gear pretty person
1,thought santini hi beginner wonder thought santini lovely look pen kind nib choose know brand maybe
1,clashing line pelikan glauco cambon sure accept normal defect consider send look line cut color part pen happen obvious capture light reluctant send order internationally online not want pay shipping fee abit bum defect glauco thing
1,birthday pen pilot custom heritage birthday pen hongdian replacement lost
1,pleasure write write slow morning perfect light dash psylocibin midori notebook mb asa gao
1,pelikan part body know place sell pelikan spare part complete body nib extra nib commonly interchange pen wonder second pen stop interchange nib
1,anybody know tighten iridium point germany pen gift parent pressure gap small originally fully tighten know tip fix
1,ink wrong place get preppy ef like try draw get converter ink set ink literally go wrong converter leaking channel mess fix input welcome thank
1,second second bottle colorverse mini empty
1,ap world note actually fun fountain pen
1,pro tip add item cart leave reason wait purchase cart beneficial starter give time think purchase maybe need consider finance want sort need good reason online store recognize email address sign news promos email requirement get cart merchandise smell sale close hand shop end send coupon entice hurry purchase common practice online retailer find especially true niche hobby participate end post say want pay msrp discount sale coupon come point exception les fast choice pay msrp case check shop side atlantic pacific japanese release spectacular comparison counterpart well amp packaging freebie etc experience ymmv price low local shop idk common knowledge mention post today figure good info know learn til recently
1,pen pad post note lol need crab jk bitter crabless
1,find beautiful blue black ink recommendation
1,amp lamy ink difference ml difference guess line normal standard colour crystal ink exactly crystal ink naming line colour sparkle name crystal ink
1,lamy dark lilac stain buy new ink swatche wearingheul swatch paint brush pilot dip pen swatch dark lilac despite ink wash brush time try paper towel get little bit purple maybe pigment pigment sheen stain think put eye dropper pen get time opus demonstrator guess good idea put go clear acrylic experience leave ink demo pen issue thank fountainpens appreciate love community
1,frankenpen think build frankenpen spare montblanc nib find offer bock feed collar new style nib wait answer custom request option build affordable like ranga start bare montblanc nib pic attention
1,fountain pen hey post get lamy fountain pen got birthday gift turn recently excited use welcome advice go to journal get leuchtturm use bottle lamy black fill mainly share cause excitement lol
1,unpopular opinion buy second hand instead new encourage good second hand pen buy pay new pen thing able comperatively price new pen converter gold nib etc example obtain sheaffer imperial cheap price escape remember way street price eco pen great practice fix pen tune nibs etc evidence right repair campaign self sustainment need thing think buy new pen strain planet order produce new fountain finite material steel gold mine second hand pen concern need like have pen history think exciting way pen engrave company person pencil case finish recommend visit local flea market
1,regular fountain pen ink use not think fit pen syringe pour cartridge pen
1,recommend new pen currently use lamy studio mm stub ideally lamy size capable range stub worth say lamy stub suit thank advance richard
1,pilot collection long start fountain pen world declare pilot brand decent collection pen common couple little picture kakuno mr super burberrys deluxe picture kakuno prera namiki falcon decimo custom custom burberrys pen probably interesting look like pilot manufacture pen point past body nib pen reminiscent deluxe take pilot cartridge write
1,wing sung ebonite piston filler nib know usual stationary store aliexpress selection multiple color choice white gold trim white trim piece white metal palladium plate nib compare dimension little short girth imagine present somewhat stubby pen look apparently heartbeat nib model ws style nib offer size long knife tip price usd regular nib usd long knife nib tell wing sung introduce series pen june number nib hope price reasonable
1,get fountain pen
1,pilot custom write smoothly show ink quality worth penny
1,brand picture left right kaweko sport iridescent pearl majohn transparent twsbi diamond iris platinum preppy violet diplomat magnum prismatic purple noodler creep clear lamy vista black conklin duragraph abalone night edison premiere delphinium jinhao shark black pilot vanishing point decimo champagne sailor compass transparent purple question brand try
1,inexpensive heavy fountain pen hi currently pen collection soon pen light plastic ebonite heavy pen sheaffer targa slim relatively inexpensive heavy pen maybe brass
1,ink help want color match girlfriend eye good pick thank idea whomever post early week concept comment
1,order twsbi eco fine nib think send wrong size help figure size nib
1,lamy vista
1,help identify mb hi find montblanc good price marketplace sure model hope think idea
1,wife new pen day arrive mail
1,feather pen fun new pen new journal inside tomo amazon get sticker dollar store get pen amazon
1,new pens day left platinum izumo charcoal tiger bamboo grove right sailor sakura nagare prime minister gift kop size
1,survivor deep de stash
1,prop fp youtubers willing god awful handwriting world
1,ebay listing nib hello people fp reddit want buy nib see stock aliexpress go ebay problem non ebay listing indication nibsize give see nib variant want buy wrong know one ebay nib state kind regard
1,help choose pen recently win award want pen commemorate look complete collection lamy dialog lamy visconti probably mythos ve notice multiple lamy available amazon ebay dollar go want ask dialog fake common ebay etc reasonable price know fake thing visconti mythos think buy goulet go twist ask choose writing plenty pen ink happy interested memorable moment pick want not automatic pick lol
1,npd want shape heart pretty pen wishlist come straight japan pink fit pink pen
1,love color ink
1,fp draw draw draw session daughter terrible thought mind cold wear big hoodie kg vs kg look small inside hoodie like fairy inside knight armor know strong walk path hope think fill boot case hoodie see mean juggle company lot stuff aim insecure feeling inside drive focus thing normal pencil later finish kawaco perkeo nib
1,actual emerald chivor
1,platinum izumo soratame green new pen day add small tamenuri collection
1,gold nib question hey look buy gold nib pen want suggestion rec research want overboard price let pretty simple man que lynard skynard want terribly flashy prefer silver trim pen aesthetically favorite pen shape one fc hexo thought
1,unpopular opinion promote hyper consumerism like community notion rabbit hole fountain pen interest cycle instant gratification regularize spend half wallet pen help joke nature get take experienced enthusiast literally hate post judge collection humble literally short collection pen like notion fit enthusiast pen prestigious judge humble collection fact feel shy bad spend dollar pen thing like buy pro gear pro gear practice thickness line think community begin idea fountain pen treasure expensive ass hobby wealthy buy prestigious pen invest money gain wealth good case scenario money pen money bad case scenario lose money learn productive character building test right theoretical humble collection beginner pen level pen entry gold nib pen option buy worth pen think limited edition sailor pro gear pilot new hand discover worth pen think pilot beautiful pro gear slim grail pen whilst like direct downgrade grail pen want pen afford take month save money know buy
1,current pen month cheeky npd keen post write journal like handwriting personal feel like page journal go fill today current favourite pen sailor pro gear slim moroccan mint tea mint sugar ink ink collection moroccan mint tea add sneaky npd opus minty orange kanwrite flex nib medium
1,ink dry quick cheap pen hey nib nerd wonder montblanc pelikan love em campo marzio lamy safari maybe dumb question answer ink flow easy month well pen usually soak marzio lamy free different wording engineering characteristic mb result well old ink flow
1,value pen hello fountainpens father find pen go grandfather stuff tell bit potential value thank
1,wrong
1,npd twsbi eco caffee amp bronze course ink ro caffe crema give juicy shading nib great combo
1,wfh aesthetic
