subreddit,processed_text
1,sheaffer crack fix guess plastic turn brittle portion crumble gift bit heartbroken pen doctor fix thank
1,leave fp home today join monday pity hey read story join pity get tired today wake feed baby overnight start morning routine pack lunch box get wallet key fountain pen right wingsung flighter pleasant pen use today day week work staycation family halfway country come visit thing pull outlook email drag go email need fix database note pull fp pocket recently restore parker demi thing cross mind pen expect pen ink go rotate wingsung run dry think platinum preppy desk case happen surprise see lose take desk later hopefully penable feel pain fp use work today backup go replace backup problem get use ballpoint pen like plebeian guess humbling day realize appreciate fountain pen tell happen breakdown curious know
1,finally figure paper realize paper big deal fountain pen bunch sample retry single midori paper super impressed realize good ink look staple notebook hold candle midori paper
1,pen dry fast buy new lamy safari couple week ago great pen notice dry fast sure cap use day write soak tip water dip soak attach notebook store upright dry fast know faulty model return comparison regal fountain pen work fine week month
1,new pen day pro gear slim wow write beautifully
1,esterbrook botanical gardens pen meadowlark botanical gardens girlfriend bring esterbrook estie botanical gardens pen journaler nib meadowlark botanical gardens find amazing spot picture
1,look ink good shitty quality paper need ink use paper bad standard printer copy paper need ink bleed like like ink feather reason use well paper school assignment bad quality paper possible like ink black black blue blue care bonus ink high shading priority thing nice fast dry time second priority requirement bleed feathering black black blue blue colour thing want need high shading fast dry time try waterman serenity blue bleed paper feather edit lamy safari medium nib size
1,currently ink take moment enjoy appreciate small collection easy suck hunting new pen time appreciate actually write one
1,truly cloud
1,feel hyped bottle black ink anyways thank black ink recommendation use matura final exam
1,twsbi replacement twsbi eco jade cap crack point cause ink leak fair cap begin crack daily pen thankfully contact customer service twsbi website get touch able send exact replacement cap cap arrive custom fast think start vacation well expect
1,choose exit pen buying right realize need stop pen buying amass large collection pen need enjoy decide stop promise self buy grail pen sell house week tear otto hutt graff von fc pen look design classic experience preferably detail feel
1,buy stabilo grow fp surprisingly good medium nib brand stabilo wonder know source
1,sketch kaweco sport
1,water dip pen turn cool ink little jar water desk use unclog ink pen week evaporate new ink
1,tip new muji aluminium pen function well try pen store flow colour incredible super dark super smooth buy unfortunately experience new pen tip activate new pen lamy safari lamy joy show issue work fresh box thank ton
1,currently ink tell get excited try new bottle yama budo
1,fp friendly printer paper look option fp friendly printer paper standard paper terribly heavy lot bleed anybody like
1,kanwrite desire emperor hi help choose pen daily writing option consider kanwrite desire kanwrite emperor ebonite feed desire know light weight pen toh color option weight gm cap emperor fairly new pen metal body ebonite feed heavy gm cap gm cap like look size decide suitable
1,swap fountain ballpoint
1,small collection think time soon wanna enjoy
1,ink match gold trim sea glass estie info leak gift oversize esterbrook estie upcoming birthday sunday need matchy matchy recommendation need accurate moody subdue nice chromoshader nice
1,way
1,guy favorite fountain pen material resin metal steel brass aluminum ebonite celluloid ceramic wood personally favorite celluloid love tactile feel hand unique pattern pity celluloid pen anymore
1,troublemaker purple yam accurate purple ink wooow
1,good afternoon
1,week carry vintage reform week carry image reform fountain pen rohrer amp klingner leipziger schwarz reform fountain pen pelikan edelstein aventurine reform rollerball schnieder topball mm black reform ballpoint schnieder office blue generally fp non fp pocket load fp week bacl reform
1,bpught ef lamy safaris write feels bit scratchy help joke aside writinf eith hsrd tip
1,pen
1,need waterman gift waterman uncle impressed jinhao fine love prefer fine nib need waterman fountain pen live india budget ruppee recommendation
1,parker pen michelin man try research not find set know year belong grandfather think maybe
1,tell
1,zebra pencil make liliput look massive compact travel sketching kit assemble
1,guess heavy hitter fill passport form
1,thumb hurt write thumb hurt write fountain pen lateral tripod grip base middle thumb hurt write extended period time problem grip pen hard
1,faber castle ambition heck change refill cartridge hate easy style present son need work try stack spare body push cartridge nib joy brand cartridge proper faber cartridge
1,exist look stand new desk hope display pen vertically easy access like image attach exist dream ink pelikan turquoise interested
1,vintage pilot elite model script nib gold nib
1,year manila pen exclusives inks umang tropical sand enjoy ink
1,cartridge fountain pen stuck fountain pen cartridge stick inside suggestion remove
1,favorite pen waterman expert slowly grow expensive pen far feel mediocre sweet spot find overtime find sweet spot good ink pairing grow pen journaling write important note overall leisure writing currently ink noodler ink liberty elysium office lighting phone camera justice absolutely gorgeous blue right environment
1,today pen use teeny tiny wahl
1,ryan krusac dragon slayer barrel find moose antler stop gaze mythological scrimshaw like fountain pen collection ink pen away drawer dogma need loosen little
1,sailor pgs japanese sweet gorgeous collection preorder eu vendor wait expect april release day leave month hope soon stilostile countdown say stock day hope true plan get
1,urahairo great news know lovely unique ink evidently kyoto tag receive request email year say plan bring standard non limited ink remain see exactly way super excited
1,esterbrook nib purchase vintage esterbrook pen repair discover today fit vintage technical stylograph pen mention fit old koh noor art pen use thread spec certain rotring staedtler mars picture finally taste soft temperamental nib decent flex pilot sumi decent flow get ebonite feed thick cross stroke thin stroke unflexed altogether cool nib use regularly especially tech pen cap small
1,kanwrite desire emperor hi help choose pen daily writing option consider kanwrite desire kanwrite emperor ebonite feed desire know light weight pen toh color option weight gm cap emperor fairly new pen metal body ebonite feed heavy gm cap gm cap like look size decide suitable
1,nibs adjust early fountain pen experience hear multiple source fountain pen gradually adapt handwriting sense personalize hear idea repeat recently question extend fountain pen adapt user style writing
1,starter fp set kid local aussie office max nib pen body cartridge bad right
1,thought ink ink rare hard find expensive gt pen month pick fountain pen unused original box accessory limited edition pen early couple deltas conway stewart parker duofold question ink somewhat rare pen detract collectible value ask specifically resale value perspective get plenty pen absolutely love write care resale value fence thank
1,look ink suggestion like pilot kon peki ink turquoise blue afford live india ink option available beginner sheaffer lamy al star waterman lamy shaffer pelikan pilot lapis bard diamine ink available recommendation guy
1,ready thing remember write fountain pen year ago want try way improve writing buy faber castell fountain pen omg cover blue ink hand arm face take note class fine second time like ink fly open lid ink splash wrong sorry stupid question
1,people fp community new estie want deadpool voice see pen joke aside seriousness see gorgeous estie call sweet dreams see atlas fahrney esterbrook site mighty need grab sure unicorn poop resin correct wrong itch pen resin estie good guy think
1,thought vac pen want thought see pop interest fill need immediately wait like fill mind wait limited edition color want see price later purchase brand eye purchase
1,omas gentleman cost
1,goulet site time want shop time right browse shopify message say traffic end wait hr try sad cause want support additional time
1,crack pen ink keep come
1,red chrome fountain pen spain vintage fountain pen review
1,midnight craft see desk want people pretty display tray wanna spend money plus pen holder board idk technical leave display case think turn okay
1,robert oster green green deserve apology fountain pen lesson learn week week post robert oster green green ink regret week wish retract night ago empty twsbi eco green green knock bottle spill leg pool thankfully tiled floor wife hear swear whimper terrified get permanently stain thing end lucky wash large stain leg foot go swim pool day see rinse ink clothe bathtub beautiful green water perfect bright green want page wife syringe save ink pool tile half bottle lesson spill happen night want write green load jinhao diamine sherwood green start write shocked look black flush ink refill write realise green lot ink go time write sample twsbi eco nib second jinhao nib lesson nib equal lesson nib huge difference ink look sherwood green twsbi sherwood green jinhao see realise try green green twsbi eco pen green mean pen green ink get jinhao dip green green start write ro scribble image look brown get brand new bulb syringe buy watch goulet video flush feed spurt nasty browny green stuff sink converter fill red wash clean pen multiple fill empty water put away lesson converter fill clear use clean pen mean pen clean lesson buy bulb syringe consistent comparison empty clean jinhao fill green green think sample speak sad spill worried rescue floor contaminate dirt lesson ink chance multiple pen nib work look well green green
1,parker im nib today joy
1,urahairo come see ig automatically translate text japanese
1,parker jotter alternative find enjoy simple parker jotter problem find version fine nib small get medium love finer nib know parker pen similar nib body finer point maybe similar brand
1,look suggestion hi new fountain pen literally week ago pick pilot varsity try available end love daily lot handwritten note work like decent entry level pen learn quirk real fountain pen probably like stick cartridge system swap tip extra question pen shop san francisco visit soon mind treat pen person vs online
1,upgrade hongdian forest recently get hobby world fountain pen look advice upgrade hongdian forest mustard yellow lamy al star medium think pen fat medium lamy nib write feel wide compare hongdian medium think need lamy fine match hongdian medium nib prefer prefer weight size uncap cap gravitate uncapped hongdian like look cross century ii know feel compare hongdian overall hongdian feel great fountain pen bug buy second technically pen little premium recommendation greatly appreciate
1,rule ink rule change ink colour consider suitable century black blue ink blue black consider acceptable formal correspondence like business letter etc write close friend red green ink consider pretty bad form brown acceptable situation resemble fade black violet turquoise pass blue newspaper editor refer eccentric write green ink brigade nowadays information convey electronically rule forget rule acceptable today think
1,weird pen museum museum russian émigré today take picture pen know work pen like today
1,got fountain pen birthday guy learn write calligraphy little odd question
1,help find specific paper format enjoy stapled rhodia dot grid pad specifically extra white ink show nicely primarily use notebook writing notebook rhodia sell ivory paper extra white sell notebook extra white paper rhodia use clairfontaine right
1,try lapis bard ink
1,new fp arrive transition begin fond gel pen especially pentel long time father today start modest platinum preppy feel awkward writing think go like wish luck
1,normal brand new kaweco sport write leave uncapped second bring brand new pen cap write fine open write stop let minute write shake tap draw blank like second write write smooth normal write measly second dry absurd highly recommend pen germany
1,favorite black ink favorite ink dark black oxblood super dark right pen love look color purple green brown
1,quill curious go path quill idea intriguing frankly whimsical fun appreciate feedback
1,pelikan black stink hi fellow comrade confirm contradict usual pelikan schwarz black stink disgusting artificial smell hard describe greeting
1,possible grind nib feel like nib nib enjoy visconti omas possible pen lamy nibmeister ask create similar writing feel assume tipping nib material difference curious thought
1,montblanc masters art homage gustav klimt blue release hour ago available
1,well buy architect nib think buy ready architect realize buy
1,look show today get lamy vista secondary lamy safari charcoal think vista look awesome charcoal matte finish safari definitely feel well hand unfortunately think mean will enjoy
1,find bag pen clean grandma house thank god keep information greatly appreciate find jaguar pen
1,decent quality pen write normal paper want ballpoint pen hope pen wet smooth write edc
1,unique timeless design love lamy look modern despite relatively unchanged year mind fountain pen meet criterion design production unique appearance subjective stereotypical plastic cigar cylinder
1,drop cap pen mess nib hey guy ask drop lamy cap properly fairly low height today foot maybe damage body nib feel weird look loupe slightly misaligned try look fine feel like maybe ocd kicking guy think go insane
1,look bit fancy zebra dispo zebra disposable fountain pen run ink today look bit fancy will break wallet use pen take note class importantly smooth writing experience ink leak paper ideally refillable okay disposable thank
1,know pen worth old harley davidson fountain pen find info online
1,pilot elite arrive straight japan date code nj love size deal get usd plus shipping nib super smooth pilot unfortunately have trouble hard start extremely dry upstroke scratchy horizontal line loupe examine find cause issue maybe flexibility gold nib think love cap close post spot gold ring great pocket pen afraid tune nib
1,bloodborne theme interested buy noodler small sample fewfountain pen accompany ink recommendation
1,pure iron gall ink dye fountain pen irongall base fountain pen ink know contain kind colour agent alongside ig component iron gall ink colouring add pot iron gall ink dip pen look pure evidence dye go dark grey darken intense shiny black indistinguishable india ink weak weak look browny grey darken dry dark pencil mark use art suitable writing imagine intense irongall component oldstyle blue black fountain pen ink risk dip ink fountain pen contain gum arabic ig ink know fountain pen contain dye colour like kwz green look intense beautiful like option fountain pen ink ig dye care scribbling hard read darken use expensive pen trouble ig ink corrode block pen know pure fountain pen friendly ig sale easy recipe
1,need help ink good ink lany safari need writing look cool converter swap
1,pen day bungubox realo norwegian wood
1,help choose black ink base cost quality good deal reference medium nib pilot metropolitan price outrageous cause canadian thank guy advance indecisive hour
1,carpink cat daily life get call cat daily life destash find review brand general try carpink
1,wing sung impressive like ahead comment knockoff montblanc say sheaffer invent cigar shape pen call balance mb immediately copy mb cigar shape pen confuse mb yada yada fortunate lot nice pen year include mb catch release love pen love pen enjoy lot wing sung premium offering like resin solid nib good fill mechanism work awesome little late party quality excellent brass piston assembly feel substantial resin feel essentially identical pelikans pilots mb write come color available round flat model available slot open ink window think flat great design turn pen look like finial nice touch nib interesting size fairly hard come term popularity scrollwork laser etch stamp leave bit desire write nib picture grind truly medium architect ink writing sample montblanc amethyst purple see youtuber throw mb sailor nib make perfect sense great pen body reasonable price love wing sung tackle pen shape necessarily spirit namiki falcon truly oversized pen nib need budget option
1,pen case make pen case want
1,jinhao chinese pen jinhao walnut jinhao way pick medium perfect package thing little inspection loupe find tine misalign bit fix converter knob little loose piston smooth saw little blue ink feed flush purple dip test flow nice wet scribble drain feed quick flushed partially fill sumi airflow issue cap tap soft mousepad time hopefully burp little air line get thick dark smooth pen angled higher normally write scratchy little feedback little polishing actually like comfortable hold good balance cap snap nicely equivalent dollar ship china
1,pen bock nib turn nibed pen little narrow wing nib leave gorgeous homeless winfield seagull open housing bock fit jowo pen usual frakenpen enabler specific combo work long spare pilot feed thank help
1,swap pelikan nib jinhao okay risk sound cheap jinhao want improve hear amazing thing pelikan nib specifically broad bb nib happy shell money nibs want mistake buy incompatible question issue swap pelikan bb jinhao need use jinhao feed feed interchangeable notice feed little snorkel go converter hole sorry silly question not ton experience swap nib
1,ebonite feed stick try instal fnf ebonite feed pilot custom nib bit forward sure sit nicely feed want retry installing pull feed stuck real good suggestion
1,spring cleaning refill dig old pen today decide thorough flush cleaning refill old properly store ink excited rotation twsbi eco fill diamine onyx black pilot metropolitan fill noodler air corp blue black kaweco sport fill noodler heart darkness
1,npd majohn
1,twsbi eco amazon legit hi folk title legit write china instead taiwan barrel sticker indicate china think tswbi taiwan miss suppose reputable seller europe
1,fill pen final study note note save tho
1,want ink opus mini baystate concord grape bad idea love color ink concerned eyedropper come try research opus material fare well definitive answer come able use fp ink
1,question waterman carene waterman carene issue leak skip
1,long shopee parcel arrive state estimate delivery date track update app stick origin country weird item ink frm tw sg
1,store extra nib hi newbie get addict fountain pen pen ef nib order different nib try lamy safari pen include calligrahy nib woundere store extra nib willing share store experience greatly appreciate photo plus googled research area particularly find good information tackle fishing box apologize silly question interested see hear input experience lot space room love inspiration people love pen appreciate understanding time
1,new hobby got pen keep say test like fountain pen idea know go like course like oh boy
1,seek absolute smooth broad bb nib fit jinhao pen post early today spare jinhao pen huge fan nib recently fascinated broad nib initially want swap pelikan nib apparently impossible lieu love hear sub thought good nib fit affordable chinese pen thank advance thought
1,find morning amazon legit laugh cause mb version grail pen chinese people make shameless lol
1,parker duofold good buy
1,lamy safari screw cap change tension cap action issue loose lamy safari cap turn finial not change tip fix rotation righty tighty clockwise increase tension unrelated see declare cool lamy ink window line nice annoyingly like
1,sheen ink question hello comrade need help read lot problem come shimmering ink little sheen one hear principle concern glitt ink high saturation question sheen ink cause pen clogging issue like shimmer lot pen know sheen accidentally spill huge drop paper mess work lol use case pen like clean feed nib tricky thank
1,visconti van gogh mini fit ink converter buy van gogh mini realise fit converter snall converter fit
1,review item large online retailer star align
1,month fountain pen platinum preppy pilot metropolitan use work belong expensive one wanna enjoy horseman apocalypse look german pen future get pilot sailor day ago btw
1,know sheene ink vinta brand example vinta inks ink bottle blue blood dugong bughaw clean
1,recommendation ink similar fwp aurorealis hello look greyish purple ink similar fwp aurorealis hope find dube expensive brand company high quality product shimmer non shimmer ink interested shade shimmer tia
1,pilot cheap amazon trust
1,like demonstrator huge fan jinhao steel nib write annoyingly especially spend money high end stuff thing bug ink getting catch cap liner continue theme collection stick black gold
1,new hobby pen play tell stop buy pen see want try
1,ink fountain pen ink lid get fountain pen stop grip writing utensil hard low pressure need write great prevent hand hurt time refill fountain pen open ink bottle lamy crystal ink bottle believe ink flat upward face plane bottle right edge lid clean get hand matter careful normal ink get turn upside right climate suction ink specific area
1,currently ink year fill pen want time decide try exhibit restraint
1,mm stub nib lamy safari issue copy peper
1,subscription box day inkflight atlas ink subscription come weekend usually inkflight single brand month collection small brand tom studio octopus fluids kuratake plus notebook midori sticker atlas especially knock park vinta lakbay sit cart love sample kaweco sport sage wait truphae march
1,diplomat aero nearly year lamy safari old parker dad give accidentally fill calligraphy ink know danger dry die write lot decide buy nice get stick choice hate aero design start grow decide shot aero finally arrive feel buetifull hand fill black lamy ink lay test pen horrible scratchy skip inspect tip appear prong slightly bent downwards easy adjust fix issue pen feel amazing happy pen afraid loose damage pretty ink recommendation
1,repair shops germany brand new parker frontier buy year ago nib come defective box silly think get replace come germany june suggested repair shop able pen usable context tip small dip make rough write paper grinding help scared inexperienced thank
1,leuchtturm paper bad leuchtturm reputation well moleskine fp journal pen sheaffer sagaris medium ink pelikan edelstein onyx bleeding exactly like moleskine brand expensive rhodia clairefontaine journal
1,leonardo mz edition tell pro con old mz amp edition round end jowo nib vs band big difference preference tia
1,draw london london draw
1,expensive pen review danitrio seiryu
1,fast sketch lovely pen platinum century ef nib size regular print paper pelikan brilliant black ink photo austria wien katholische kirche peter
1,pilot kaküno ink cap normal consider leak nib pen month notice day ink cap travel pen daily happen normal time leak nib meet grip barrel portion
1,help choose fountain pen friendly notebook work look notebook work meeting note copious doodle diagram mind map etc tend notebook quickly look thick dot page stand line page relatively cheap need use fancy paper work hate mushy paper come tick box know paper cope fountain pen use majohn exclusively work default nib grind fine stub wet writer gusher way experience brand recommendation ta
1,ferris wheel press earthday sale hello fellow inky savage ferris wheel press earthday sale give away free bottle ink purchase new ferris wheel press use referral link additional gift card
1,pilot lady rhodium white uninked moment
1,new pen day buy bag old pen local antique store bad fall apart salvageable hopefully get money worth
1,take pen notebook hair shop salon take hour perm time take notebook pen come
1,kyo oto ryukuyuiro thing useful write green ink shimmer silver medium nib broad nib problem not draw seldom use green ink write personal use note list
1,pen crab raise robo dinosaur transformer
1,waterman carene delux
1,new ink come yesterday sherwood green diamine
1,travel journaling finish travel journal day vacation morocco stay calm oasis sea help remind people meet place visit stay amazingly beautiful country
1,dehydration station leave majohn mini sun moment today happen think want dehydrate ink behave differently want minimal exposure dust fast way leave chonker pen sun remove condensation cap minute pen fit massive ink bet hour reduce water content information
1,know converter pen thank exactly know model help appreciate
1,old fountain pen cartridge mom question canister herbin french fountain pen cartridge wonder usable think purchase mid early pretty new fountain pen hear reseal cartridge use reason confuse cartridge quarter ball seal brand new guess portion ink dry time ink remain pretty watery look usable clean old ink pen want ink shot think ask pen pic reference
1,love mix bouquet leftover grey ink think clean apparently haha
1,find bag old pen clean grandma find jaguar pen additional info greatly appreciate
1,different method add flair east asian letter naginata esque pilot tight tune gold elite medium nib forget kanji sorry swordboi fan custom ground kaweco bb kanji nib yesterday realize important cut shoulder nib addition grind tipping shape thing look proper write second help twisting level effect solid gold cry get to honest pilot elite undocumented unpopular feature fact feature writing slow enjoyable like swoosh sailor style nib well
